"Name";"global_id";"Nomdescr";"Razdel";"Kod";"Idx";
"Строительство водных сооружений";"273481628";"Эта группировка включает:^- строительство гидротехнических сооружений (шлюзов, дамб и плотин);^- строительство ирригационных систем;^- производство дноочистительных, дноуглубительных и берегоукрепительных работ^Эта группировка также включает:^- сохранение и воссоздание пристаней, пирсов и аналогичных портовых сооружений, плотин и дамб, шлюзов и связанных гидромеханических сооружений, являющихся объектами культурного наследия;^- сохранение и воссоздание фонтанов, дворцовых и усадебных каскадных прудов, ансамблей и групп фонтанов и прочих гидротехнических и водных сооружений, не включенных в другие группировки^Эта группировка не включает:^- инженерно-техническое проектирование и деятельность технических консультантов в соответствующих областях, см. 71.12";"F";"42.91";"F.42.91";
"Строительство портовых сооружений";"273481630";"";"F";"42.91.1";"F.42.91.1";
"Строительство гидротехнических сооружений";"273481632";"";"F";"42.91.2";"F.42.91.2";
"Строительство ирригационных систем";"273481633";"";"F";"42.91.3";"F.42.91.3";
"Производство дноочистительных, дноуглубительных и берегоукрепительных работ";"273481635";"";"F";"42.91.4";"F.42.91.4";
"Производство подводных работ, включая водолазные";"273481637";"";"F";"42.91.5";"F.42.91.5";
"Строительство прочих инженерных сооружений, не включенных в другие группировки";"273481638";"Эта группировка включает:^- строительство промышленных сооружений за исключением зданий, таких как нефтеперерабатывающие, химические заводы;^- строительные работы, кроме строительства сооружений типа открытых спортивных сооружений;^- размежевание и благоустройство территории (например, строительство дополнительных дорог, коммунальной инфраструктуры и т. д.)^Эта группировка также включает:^- сохранение и воссоздание открытых стадионов и прочих открытых спортивных сооружений, являющихся объектами культурного наследия;^- сохранение и воссоздание таких объектов ландшафтной архитектуры, являющихся объектами культурного наследия, как, например, регулярные и пейзажные парки, в т. ч. в составе дворцово-парковых и усадебных ансамблей, сады, скверы, бульвары, аллейные посадки, кладбища;^- сохранение и воссоздание беседок, ротонд и т.п. малых архитектурных форм, относящихся к памятникам исторического ландшафта и ландшафтной архитектуры, включая произведения садово-паркового искусства, садово-парковую скульптуру;^- сохранение и воссоздание таких объектов культурного наследия как, например, колонны, колоннады, триумфальные арки, памятники историческим деятелям и деятелям культуры, стелы и т.п.;^- сохранение и воссоздание прочих инженерных сооружений, не включенных в другие группировки, являющихся объектами культурного наследия^Эта группировка не включает:^- монтаж промышленного оборудования, см. 33.20;^- размежевание земель без благоустройства, см. 68.10;^- инженерно-техническое проектирование и деятельность технических консультантов в соответствующих областях, см. 71.12";"F";"42.99";"F.42.99";
"Работы строительные специализированные";"273481640";"Эта группировка включает:^- специальную строительную деятельность (специальные отрасли), т. е. строительство частей зданий и работ гражданского строительства или подготовки^Эта деятельность обычно специализируется в одном аспекте, общем для различных структур, требующем специальных навыков или оборудования, например, забивка свай, работы по закладке фундамента, каркасные работы, бетонные работы, работы по кладке кирпича, кладка камня, подмотка, установка крыш и т. д. Монтаж стальных структур может быть включен сюда при условии, что части не произведены тем же самым подразделением. Специальная строительная деятельность главным образом выполняется согласно субконтракту, особенно при ремонте, если он выполняется непосредственно для владельца имущества. Также сюда включена конечная обработка зданий по завершении строительства. Сюда включена установка приспособлений для работоспособности здания. Действия для обеспечения работоспособности обычно выполняются на участке строительства, хотя части работ могут быть выполнены в специальной мастерской. Сюда относятся также слесарные работы, а также работы по установке отопительных и кондиционерных систем, антенн, систем сигнализации и прочие электротехнические работы, работы по установке систем пожарной сигнализации, лифтов, эскалаторов и т. д. Сюда относятся также работы по водо-, тепло- и звукоизоляции, обшивке листовым металлом, установке торговых холодильных установок, установке освещения и сигнальных систем для автомобильных и железных дорог, аэропортов, портов и т. д. А также сюда относятся ремонтные работы ко всем типам вышеперечисленных работ. Работы по полной отделке зданий включают работы, имеющие отношение к отделке, такие как полировка, штукатурные, малярные работы, плиточное покрытие полов и стен или покрытие такими отделочными материалами как паркет, ковролин, обои и т. д., а также циклевание полов, отделочные плотничные работы, звукоизолирующие работы, очистка внешней территории и т. д. Также сюда относятся ремонтные работы ко всем типам вышеперечисленных работ. Аренда оборудования с оператором классифицируется наряду с соответствующими строительными работами";"F";"43";"F.43";
"Разборка и снос зданий, подготовка строительного участка";"273481642";"Эта группировка включает:^- работы по подготовке участка для последующего строительства, включая снос существующих строений";"F";"43.1";"F.43.1";
"Разборка и снос зданий";"273481643";"Эта группировка включает:^- снос или разборку зданий и сооружений";"F";"43.11";"F.43.11";
"Подготовка строительной площадки";"273481645";"Эта группировка включает:^- расчистку территорий строительной площадки, выполнение земляных работ, включая: рытье котлованов, удаление мусора, выравнивание и планировку строительных площадок, работы по рытью траншей, удаление камней и т. д.;^- подготовку участка к разработке и добыче полезных ископаемых, за исключением нефтяных и газовых участков^Эта группировка также включает:^- дренаж строительной площадки";"F";"43.12";"F.43.12";
"Расчистка территории строительной площадки";"273481647";"";"F";"43.12.1";"F.43.12.1";
"Производство дренажных работ на сельскохозяйственных землях, землях лесных территорий, а также на строительных площадках";"273481650";"";"F";"43.12.2";"F.43.12.2";
"Производство земляных работ";"273481651";"";"F";"43.12.3";"F.43.12.3";
"Подготовка участка к разработке и добыче полезных ископаемых, за исключением нефтяных и газовых участков";"273481653";"";"F";"43.12.4";"F.43.12.4";
"Разведочное бурение";"273481655";"Эта группировка включает:^- разведочное бурение, пробное бурение и отбор образцов породы для строительных, геофизических, геологических или других подобных целей^Эта группировка не включает:^- бурение нефтяных и газовых скважин, см. 06.10, 06.20;^- предоставление услуг по разведочному бурению в ходе буровых работ, см. 09.90;^- бурение скважин на воду, см. 42.21;^- проходку шахтных стволов, см. 43.99;^- проведение нефтяной и газовой разведки, геофизических, геологических и сейсмических исследований, см. 71.12";"F";"43.13";"F.43.13";
"Производство электромонтажных, санитарно-технических и прочих строительно-монтажных работ";"273481657";"Эта группировка включает:^- монтажные работы, которые обеспечивают функционирование зданий и сооружений гражданского строительства, включая монтаж электрических систем, водопроводноканализационной сети, сети газоснабжения, системы отопления и кондиционирования, лифтов и т. д.";"F";"43.2";"F.43.2";
"Производство электромонтажных работ";"273481658";"Эта группировка включает:^- установку электротехнических систем во всех видах зданий и сооружений гражданского строительства;^- монтаж электропроводки и электроарматуры, телекоммуникаций, компьютерной сети и проводки кабельного телевидения, включая оптоволоконные линии связи, антенн всех типов, включая спутниковые антенны, осветительных систем, пожарной сигнализации, систем охранной сигнализации, уличного освещения и иного электрооборудования на автомобильных дорогах, энергообеспечения наземного электротранспорта и электротехнического сигнального оборудования, освещения взлетно-посадочных полос аэропортов и космодромов, электрических коллекторов солнечной энергии;^- выполнение работ по подводке электросетей для подключения электроприборов, кодовых замков, домофонов и прочего оборудования, включая плинтусное отопление^Эта группировка также включает:^- приспособление систем электрообеспечения на объектах культурного наследия^Эта группировка не включает:^- приспособление инженерных систем и оборудования на объектах культурного наследия, см. 43.29";"F";"43.21";"F.43.21";
"Производство санитарно-технических работ, монтаж отопительных систем и систем кондиционирования воздуха";"273481659";"Эта группировка включает:^- монтаж водопроводных систем, систем отопления и кондиционирования воздуха, включая их реконструкцию, обслуживание и ремонт;^- установку (монтаж) в зданиях или сооружениях: отопительных систем (электрических, газовых и масляных), печей и каминов, стояков водяного охлаждения, неэлектрических коллекторов солнечной энергии, водопроводного и сантехнического оборудования, оборудования вентиляции и кондиционирования воздуха и воздуховодов, газопроводной арматуры, трубопроводов для подачи пара, систем автоматического пожаротушения, автоматических систем для полива газонов;^- работу по монтажу трубопроводов^Эта группировка не включает:^- монтаж электрического плинтусного отопления, см. 43.21;^- приспособление инженерных систем и оборудования на объектах культурного наследия, см. 43.29";"F";"43.22";"F.43.22";
"Производство прочих строительно-монтажных работ";"273481661";"Эта группировка включает:^- установку (монтаж) оборудования, кроме систем отопления и кондиционирования воздуха, или инженерного оборудования в зданиях и сооружениях гражданского строительства^Эта группировка включает:^- установку (монтаж) в зданиях или сооружениях: лифтов, эскалаторов, включая их ремонт и обслуживание, автоматических и вращающихся дверей, молниеотводов, систем очистки воздуха, тепловой, звуковой или виброизоляции^Эта группировка также включает:^- приспособление инженерных систем и оборудования на объектах культурного наследия^Эта группировка не включает:^- установку в зданиях и сооружениях инженерного оборудования, см. 33.20";"F";"43.29";"F.43.29";
"Работы строительные отделочные";"273481663";"Эта группировка также включает:^- реставрацию, консервацию и воссоздание штукатурной отделки на объектах культурного наследия;^- реставрацию и воссоздание керамического декора на объектах культурного наследия;^- реставрацию и воссоздание мозаики на объектах культурного наследия;^- реставрацию и воссоздание янтарного набора на объектах культурного наследия;^- реставрацию, консервацию и воссоздание поверхности из искусственного мрамора на объектах культурного наследия;^- реставрацию и воссоздание паркетных полов на объектах культурного наследия;^- реставрацию и воссоздание наружных и внутренних декоративно-художественных покрасок на объектах культурного наследия;^- реставрацию, консервацию и воссоздание архитектурно-лепного декора на объектах культурного наследия^Эта группировка не включает:^- воссоздание отдельных элементов и деталей объектов культурного наследия, например, элементов и деталей деревянного или архитектурно-лепного декора, мраморных, керамических и терракотовых плит, изразцов и т.п., производство специальных реставрационно-строительных материалов, например, растворов, красок, эмалей, клеевых составов и т.п., а также изготовление специальной оснастки, например, форм, опок, тиглей и т.п., проводимые в мастерских, см. группировки раздела С (в зависимости от материала, назначения и конструктивных особенностей изделия)";"F";"43.3";"F.43.3";
"Производство штукатурных работ";"273481665";"Эта группировка включает:^- наружные и внутренние штукатурные работы в зданиях и сооружениях, включая установку арматурных сеток^Эта группировка также включает:^- реставрацию, консервацию и воссоздание штукатурной отделки на объектах культурного наследия";"F";"43.31";"F.43.31";
"Работы столярные и плотничные";"273481667";"Эта группировка включает:^- установку дверей (кроме автоматических и вращающихся), окон, дверных и оконных рам из дерева или прочих материалов;^- монтаж сборных кухонных гарнитуров, шкафов, лестниц, торгового оборудования и т.п.;^- внутреннюю отделку, такую как устройство потолков, раздвижных и съемных перегородок и т.д.^Эта группировка не включает:^- установку автоматических и вращающихся дверей, см. 43.29^– ремонт и реставрацию оконных и дверных приборов на объектах культурного наследия, см. 43.99;^– ремонт, реставрацию и консервацию деревянных конструкций и деталей на объектах культурного наследия, см. 43.99;^– реставрацию деталей из черного и цветных металлов на объектах культурного наследия, см. 43.99";"F";"43.32";"F.43.32";
"Установка дверей (кроме автоматических и вращающихся), окон, дверных и оконных рам из дерева или прочих материалов";"273481669";"Эта группировка не включает:^– ремонт и реставрацию оконных и дверных приборов на объектах культурного наследия, см. 43.99;^– ремонт, реставрацию и консервацию деревянных конструкций и деталей на объектах культурного наследия, см. 43.99;^– реставрацию деталей из черного и цветных металлов на объектах культурного наследия, см. 43.99^";"F";"43.32.1";"F.43.32.1";
"Работы по установке внутренних лестниц, встроенных шкафов, встроенного кухонного оборудования";"273481671";"Эта группировка не включает:^– ремонт, реставрацию и консервацию деревянных конструкций и деталей на объектах культурного наследия, см. 43.99;^– реставрацию деталей из черного и цветных металлов на объектах культурного наследия, см. 43.99";"F";"43.32.2";"F.43.32.2";
"Производство работ по внутренней отделке зданий (включая потолки, раздвижные и съемные перегородки и т.д.)";"273481673";"Эта группировка не включает:^– ремонт, реставрацию и консервацию деревянных конструкций и деталей на объектах культурного наследия, см. 43.99;^– реставрацию деталей из черного и цветных металлов на объектах культурного наследия, см. 43.99";"F";"43.32.3";"F.43.32.3";
