"Name";"global_id";"Nomdescr";"Razdel";"Kod";"Idx";
"Производство пластмассовых плит, полос, труб и профилей";"273480457";"Эта группировка включает:^- производство полуфабрикатов из пластмасс, таких как: пластмассовые плиты, полосы, блоки, пленки, фольга, листы (включая самоклеящиеся);^- производство готовых изделий из пластмасс: пластмассовых труб, рукавов и шлангов, приспособлений для шлангов и рукавов, целлофановой пленки или листа;^- производство труб и шлангов для уранодобывающего производства;^- производство покрытий полимерных защитных для улучшения радиационной обстановки^Эта группировка не включает:^- производство пластмасс в первичных формах, см. 20.16;^- производство изделий из синтетической и натуральной резины, см. 22.1";"C";"22.21";"C.22.21";
"Производство пластмассовых изделий для упаковывания товаров";"273480458";"Эта группировка включает:^- производство пластмассовых изделий для упаковывания товаров: пластмассовых мешков, пакетов-сумок, футляров, ящиков, коробок, баллонов, бутылок и т. п.^Эта группировка не включает:^- производство чемоданов и сумок, см. 15.12";"C";"22.22";"C.22.22";
"Производство пластмассовых изделий, используемых в строительстве";"273480460";"Эта группировка включает:^- производство пластмассовых изделий, используемых в строительстве: пластмассовых дверей, окон, рам, ставен, жалюзи, плинтусов, баков, резервуаров, пластмассовых покрытий для облицовки стен и потолков, в рулонах или в форме плиток и т. п., пластмассовых санитарнотехнических изделий: пластмассовых ванн, душей, раковин, унитазов, смывных бочков и т. п.;^- производство эластичных напольных покрытий, таких как винил, линолеум и т. д.;^- производство искусственного камня (например, обработанного мрамора)";"C";"22.23";"C.22.23";
"Производство прочих пластмассовых изделий";"273480461";"Эта группировка включает:^- производство пластмассовых столовых и кухонных изделий и туалетных принадлежностей;^- производство различных пластмассовых изделий: пластмассовых головных уборов, изолирующей арматуры, деталей осветительной арматуры, канцелярских и школьных принадлежностей, предметов одежды (склеенных, не сшитых), фурнитуры для мебели, самоклеящейся пленки, статуэток, конвейерных лент и приводных ремней, клейкой ленты, обувных колодок, пластмассовых сигар и мундштуков, расчесок, бигуди, пластмассовых сувениров т.д.^Эта группировка не включает:^- производство пластмассовых дорожных изделий, см. 15.12;^- производство обуви из пластмасс, см. 15.20;^- производство мебели из пластмасс, см. 31.01, 31.02, 31.09;^- производство необтянутых матрасов из пенопласта, см. 31.03;^- производство спортивного инвентаря из пластмасс, см. 32.30;^- производство игр и игрушек из пластмасс, см. 32.40;^- производство стоматологических инструментов и принадлежностей, производство инструментов и принадлежностей, применяемых в медицинских целях, см. 32.50;^- производство пластиковых офтальмологических принадлежностей, см. 32.50;^- производство пластмассовых защитных касок и прочих защитных изделий, см. 32.99^Эта группировка также включает:^- производство устройств запорно-пломбировочных из пластика";"C";"22.29";"C.22.29";
"Производство предметов одежды и аксессуаров для нее, включая перчатки, из пластмасс";"273480463";"";"C";"22.29.1";"C.22.29.1";
"Производство прочих изделий из пластмасс, не включенных в другие группировки, кроме устройств пломбировочных их пластика";"273480464";"";"C";"22.29.2";"C.22.29.2";
"Предоставление услуг в области производства прочих пластмассовых изделий";"273480466";"";"C";"22.29.9";"C.22.29.9";
"Производство прочей неметаллической минеральной продукции";"273480468";"Эта группировка включает:^- производственную деятельность, относящуюся к производству изделий на минеральной основе^Эта группировка включает:^- производство стекла и изделий из стекла (например, листового стекла, полого стекла, стекловолокна и др.), керамических изделий, напольных покрытий, кафеля, черепицы, цемента и штукатурки и т. д.^Эта группировка также включает:^- производство отделочного камня и прочей минеральной продукции";"C";"23";"C.23";
"Производство стекла и изделий из стекла";"273480470";"Эта группировка включает:^- производство всех видов стекла, изготовленных различными способами, и изделия из стекла";"C";"23.1";"C.23.1";
"Производство листового стекла";"273480472";"Эта группировка включает:^- производство листового стекла, включая армированное, окрашенное и матовое листовое стекло";"C";"23.11";"C.23.11";
"Производство листового тянутого стекла";"273480473";"";"C";"23.11.1";"C.23.11.1";
"Производство листового узорчатого, прокатного (но не обработанного другим способом): неармированного стекла";"273480475";"";"C";"23.11.2";"C.23.11.2";
"Производство листового узорчатого, прокатного (но не обработанного другим способом): армированного стекла";"273480476";"";"C";"23.11.3";"C.23.11.3";
"Производство бесцветного листового стекла, изготовленного методом флоат";"273480477";"";"C";"23.11.4";"C.23.11.4";
"Формирование и обработка листового стекла";"273480479";"Эта группировка включает:^- производство многослойного и закаленного стекла;^- производство стеклянных зеркал;^- производство многослойных изолирующих изделий из стекла";"C";"23.12";"C.23.12";
"Производство упрочненного (в том числе термически упрочненного и закаленного) стекла";"273480481";"";"C";"23.12.1";"C.23.12.1";
"Производство стеклянных зеркал";"273480483";"";"C";"23.12.2";"C.23.12.2";
"Производство многослойного стекла для строительства";"273480485";"";"C";"23.12.3";"C.23.12.3";
"Производство полых стеклянных изделий";"273480486";"Эта группировка включает:^- производство бутылок и прочих емкостей из стекла или хрусталя;^- производство стаканов, фужеров, рюмок, бокалов, чашек и прочих бытовых изделий из стекла или хрусталя^Эта группировка не включает:^- производство стеклянных игрушек, см. 32.40";"C";"23.13";"C.23.13";
"Производство бутылок и прочих емкостей из стекла или хрусталя";"273480487";"";"C";"23.13.1";"C.23.13.1";
"Производство стаканов и прочих сосудов для питья из стекла или хрусталя";"273480490";"";"C";"23.13.2";"C.23.13.2";
"Производство столовой и кухонной посуды из стекла или хрусталя";"273480491";"";"C";"23.13.3";"C.23.13.3";
"Производство туалетных и канцелярских принадлежностей из стекла или хрусталя";"273480493";"";"C";"23.13.4";"C.23.13.4";
"Производство украшений для интерьера и аналогичных изделий из стекла или хрусталя";"273480494";"";"C";"23.13.5";"C.23.13.5";
"Производство стеклянных колб для вакуумных сосудов";"273480496";"";"C";"23.13.6";"C.23.13.6";
"Производство стекловолокна";"273480498";"Эта группировка включает:^- производство стекловолокна, в том числе стекловаты и нетканых материалов из него^Эта группировка не включает:^- производство тканых материалов из стекловолокна, см. 13.20;^- производство волоконно-оптических кабелей для передачи данных или передачи изображений, см. 27.31";"C";"23.14";"C.23.14";
"Производство и обработка прочих стеклянных изделий, включая технические изделия из стекла";"273480499";"Эта группировка включает:^- производство лабораторных, фармацевтических и гигиенических изделий из стекла;^- производство стекол для часов или очков, оптического стекла или оптических элементов, не подвергнутых оптической обработке;^- производство стеклянных деталей для изготовления бижутерии;^- производство электрических изоляторов из стекла;^- производство стеклянных оболочек для ламп и плафонов;^- производство стеклянных статуэток;^- производство блоков из стекла для мощения (бруса и брусчатки);^- производство стекла в виде прутков и труб;^- производство изделий из многослойного и закаленного стекла^Эта группировка не включает:^- производство оптических элементов из стекла с оптической обработкой, см. 26.70;^- производство шприцов и прочего лабораторного оборудования, применяемых в медицинских целях, см. 32.50";"C";"23.19";"C.23.19";
"Производство необработанного стекла в блоках, в виде шаров, прутков, труб или трубок";"273480501";"";"C";"23.19.1";"C.23.19.1";
"Производство блоков для мощения, стеклоблоков, плит и прочих изделий из прессованного или отформованного стекла, используемых в строительстве; производство стекла для витражей; производство многоячеистого стекла или пеностекла в блоках, плитах и аналогичных формах";"273480503";"";"C";"23.19.2";"C.23.19.2";
"Производство стеклянных колб для электрических ламп, электронно-лучевых приборов или аналогичных изделий";"273480505";"";"C";"23.19.3";"C.23.19.3";
"Производство стекол для часов или очков, не подвергнутых оптической обработке";"273480506";"";"C";"23.19.4";"C.23.19.4";
"Производство посуды для лабораторных, фармацевтических и гигиенических целей из стекла; производство ампул и прочих изделий из медицинского стекла";"273480508";"";"C";"23.19.5";"C.23.19.5";
"Производство стеклянных деталей электрических ламп и осветительной арматуры, световых указателей, световых табло и аналогичных изделий";"273480510";"";"C";"23.19.6";"C.23.19.6";
"Производство электрических изоляторов из стекла";"273480512";"";"C";"23.19.7";"C.23.19.7";
"Производство прочих изделий из стекла, не включенных в другие группировки";"273480513";"";"C";"23.19.9";"C.23.19.9";
"Производство огнеупорных изделий";"273480516";"";"C";"23.2";"C.23.2";
"Производство огнеупорных изделий";"273480517";"Эта группировка включает:^- производство огнеупорных строительных растворов, цементов, бетонов и т. п.;^- производство огнеупорных керамических товаров: огнеупорных керамических изделий из силикатной муки, огнеупорных кирпичей, блоков и плиток, реторт, тиглей, муфелей, форсунок, труб, трубок, изложниц и т. п.;^- производство огнеупорных изделий, содержащих магнезит, доломит и хромит";"C";"23.20";"C.23.20";
"Производство огнеупорных кирпичей, блоков, плиток";"273480519";"";"C";"23.20.1";"C.23.20.1";
"Производство огнеупорных цементов, растворов, бетонов и аналогичных составов";"273480521";"";"C";"23.20.2";"C.23.20.2";
"Производство безобжиговых огнеупорных изделий";"273480523";"";"C";"23.20.3";"C.23.20.3";
"Производство прочих огнеупорных керамических изделий";"273480525";"";"C";"23.20.9";"C.23.20.9";
"Производство строительных керамических материалов";"273480527";"";"C";"23.3";"C.23.3";
"Производство керамических плит и плиток";"273480529";"Эта группировка включает:^- производство неогнеупорной керамической плитки для внутренней и внешней облицовки стен и фасадов зданий, мозаичной плитки и т. п.;^- производство неогнеупорных керамических плит и блоков для мощения^Эта группировка не включает:^- производство искусственного камня, см. 23.61;^- производство огнеупорных керамических изделий, см. 23.20;^- производство керамического кирпича, напольных покрытий и кровельных материалов, см. 23.32";"C";"23.31";"C.23.31";
"Производство кирпича, черепицы и прочих строительных изделий из обожженной глины";"273480531";"Эта группировка включает:^- производство неогнеупорных строительных материалов из глины: керамического кирпича, кровельной черепицы, дефлекторов, труб, трубопроводов;^- производство блоков для пола из обожженной глины^Эта группировка не включает:^- производство огнеупорных керамических изделий, см. 23.20;^- производство нестроительных неогнеупорных керамических изделий, см. 23.4";"C";"23.32";"C.23.32";
"Производство прочих фарфоровых и керамических изделий";"273480533";"";"C";"23.4";"C.23.4";
"Производство хозяйственных и декоративных керамических изделий";"273480535";"Эта группировка включает:^- производство столовой керамической посуды и прочих хозяйственных и туалетных керамических принадлежностей,^- производство статуэток и прочих декоративных керамических изделий^Эта группировка не включает:^- производство бижутерии, см. 32.13;^- производство керамических игрушек, см. 32.40";"C";"23.41";"C.23.41";
"Производство столовой и кухонной керамической посуды";"273480537";"";"C";"23.41.1";"C.23.41.1";
"Производство прочих хозяйственных и туалетных керамических принадлежностей";"273480539";"";"C";"23.41.2";"C.23.41.2";
"Производство статуэток и прочих декоративных керамических изделий";"273480541";"";"C";"23.41.3";"C.23.41.3";
"Производство керамических санитарно-технических изделий";"273480542";"Эта группировка включает:^- производство керамических санитарно-технических изделий, таких как раковины, ванны, биде, сливные бачки;^- производство прочих керамических изделий^Эта группировка не включает:^- производство огнеупорной керамики, см. 23.20;^- производство керамических строительных материалов, см. 23.3";"C";"23.42";"C.23.42";
"Производство керамических изоляторов и изолирующей арматуры";"273480544";"Эта группировка включает:^- производство электрических изоляторов и изолирующей арматуры из керамики^Эта группировка не включает:^- производство огнеупорной керамики, см. 23.20";"C";"23.43";"C.23.43";
"Производство прочих технических керамических изделий";"273480546";"Эта группировка включает:^- производство керамических и ферритовых магнитов;^- производство керамических изделий лабораторного, химического и промышленного назначения^Эта группировка не включает:^- производство искусственного камня, см. 23.61;^- производство огнеупорных керамических изделий, см. 23.20;^- производство керамических строительных материалов, см. 23.3";"C";"23.44";"C.23.44";
"Производство керамических изделий лабораторного, химического и промышленного назначения";"273480548";"";"C";"23.44.1";"C.23.44.1";
"Производство керамических и ферритовых магнитов";"273480550";"";"C";"23.44.2";"C.23.44.2";
"Производство прочих керамических изделий";"273480552";"Эта группировка включает:^- производство керамических горшков, банок, кувшинов и подобных изделий, используемых для транспортирования или упаковывания товаров;^- производство керамических изделий, не включенных в другие группировки^Эта группировка не включает:^- производство керамического гигиенического сантехнического оборудования, см. 23.42;^- производство искусственных зубов, см. 32.50";"C";"23.49";"C.23.49";
"Производство керамических горшков, банок, кувшинов и подобных изделий, используемых для транспортирования или упаковывания товаров";"273480554";"";"C";"23.49.1";"C.23.49.1";
"Производство керамических изделий, не включенных в другие группировки";"273480555";"";"C";"23.49.9";"C.23.49.9";
"Производство цемента, извести и гипса";"273480557";"";"C";"23.5";"C.23.5";
"Производство цемента";"273480559";"Эта группировка включает:^- производство цементного клинкера и гидравлических цементов, в том числе портландцемента, глиноземистого цемента, шлакового цемента и суперфосфатного цемента^Эта группировка не включает:^- производство огнеупорных цементов и бетонов и т. п., см. 23.20;^- производство товарного бетона, см. 23.63;^- производство сухих бетонных смесей строительных растворов, см. 23.64;^- производство прочих изделий из цемента и гипса, см. 23.69;^- производство цементов, используемых в стоматологии, см. 32.50";"C";"23.51";"C.23.51";
"Производство извести и гипса";"273480561";"Эта группировка включает:^- производство негашеной, гашеной и гидравлической извести;^- производство штукатурки из обожженного гипса и обожженного (кальцинированного) сульфата^Эта группировка также включает:^- производство кальцинированного доломита";"C";"23.52";"C.23.52";
"Производство негашеной, гашеной и гидравлической извести";"273480563";"";"C";"23.52.1";"C.23.52.1";
"Производство гипса";"273480565";"";"C";"23.52.2";"C.23.52.2";
"Производство кальцинированного доломита";"273480567";"";"C";"23.52.3";"C.23.52.3";
